{
  "packages": [
    {
      "id": 55308,
      "organization": "ballerina",
      "name": "http",
      "version": "2.17.0",
      "platform": "java21",
      "languageSpecificationVersion": "2024R1",
      "isDeprecated": false,
      "deprecateMessage": "",
      "URL": "/ballerina/http/2.17.0",
      "balaVersion": "3.0.0",
      "balaURL": "https://fileserver.central.ballerina.io/2.0/ballerina/http/2.17.0/ballerina-http-java21-2.17.0.bala?Expires=1788565358&Signature=fGjAr-KENFK4L4P5vpSY7pj3U2VT38bKLUVW-BzteZRBrf~KCOFSN7qYdDKXZjJMkI36ZwdI3rh1WDhdS0XGQ8HR~ytKxrEC7hkRPVqJ6fHpJuhvPiolyZnKwQJdNKazoJX3Vbnfa~Pe3SLLnjUjknWcD-HJwPd7tVM~orzNE2lRQKWnW8~V8l07LtzNWG03zYOaE48IzkzNIPlC215PtgtfHrpkI~MFxPFUdNyWDyxuJGS0i8rcgExSc7NShHNuOjORPFqTt0Fw6O6eh3Fd8PIOdQfyM-a-NKDhBoM9YESd~R~fdDOKhdneFc-z39vhf15EW0QZrqys3eO3twDUyQ__&Key-Pair-Id=K27IQ7NPTKLKDU",
      "digest": "sha-256=4bf9e5c7841894e19f2c375d1ed71780127fa1b4d64e4ffae87e527b81fd720b",
      "summary": "This module provides APIs for connecting and interacting with HTTP and HTTP2 endpoints. It facilitates two types of network entry points as the `Client` and `Listener`.",
      "readme": "",
      "template": false,
      "licenses": [
        "Apache-2.0"
      ],
      "authors": [
        "Ballerina"
      ],
      "sourceCodeLocation": "https://github.com/ballerina-platform/module-ballerina-http",
      "keywords": [
        "http",
        "network",
        "service",
        "listener",
        "client"
      ],
      "ballerinaVersion": "2201.13.6",
      "icon": "https://bcentral-packageicons.azureedge.net/images/ballerina_http_2.17.0.png",
      "ownerUUID": "b5a9e54d-8ade-47a1-8abc-6bc46e89069d",
      "createdDate": 1788517274000,
      "pullCount": 1888984,
      "visibility": "public",
      "modules": [
        {
          "packageURL": "/ballerina/http/2.17.0",
          "apiDocURL": "https://lib.ballerina.io/ballerina/http/2.17.0",
          "name": "http",
          "summary": "",
          "readme": ""
        },
        {
          "packageURL": "/ballerina/http/2.17.0",
          "apiDocURL": "https://lib.ballerina.io/ballerina/http.httpscerr/2.17.0",
          "name": "http.httpscerr",
          "summary": "",
          "readme": ""
        }
      ],
      "balToolId": "",
      "graalvmCompatible": "Unknown"
    },
    {
      "id": 51990,
      "organization": "ballerina",
      "name": "crypto",
      "version": "2.12.1",
      "platform": "java21",
      "languageSpecificationVersion": "2024R1",
      "isDeprecated": false,
      "deprecateMessage": "",
      "URL": "/ballerina/crypto/2.12.1",
      "balaVersion": "3.0.0",
      "balaURL": "https://fileserver.central.ballerina.io/2.0/ballerina/crypto/2.12.1/ballerina-crypto-java21-2.12.1.bala?Expires=1788565358&Signature=rmwctqegv2HTS-2OGPGCkxwPyyxlZhAqC-7pXGhtRIO1QovfCeCvawI8W5xGDL1RIm2vbdmaB4gF7QizWlrtbHvt8eY7j-ch2sy-M1W9sLNs146NzJVdIUqWawtKi2NwA8f5x6uLfyuiB8pCU3MamoAFzPYCQt2TQQKLrm08XA7pvG40rSKGDdQXabIBy~ZSSCs3HHLoH-amybqUGco35NGC7AoNt-dIqvWrKRssOkv1H0GubYWzTVnl0XheG33IbCgpHHgi3INsdzohE22kU1Zps3ehp-M22cBVVifBsM~nCC3Om0KnJ2PF9nUoIQs8dVl764e5I5QMXYN2CeUyVQ__&Key-Pair-Id=K27IQ7NPTKLKDU",
      "digest": "sha-256=65104fe63eb5766ea5eb91e2105fb777c64e82e157784c00749e492bd346a4c5",
      "summary": "This module provides common cryptographic mechanisms based on different algorithms.",
      "readme": "",
      "template": false,
      "licenses": [
        "Apache-2.0"
      ],
      "authors": [
        "Ballerina"
      ],
      "sourceCodeLocation": "https://github.com/ballerina-platform/module-ballerina-crypto",
      "keywords": [
        "security",
        "hash",
        "hmac",
        "sign",
        "encrypt",
        "decrypt",
        "private key",
        "public key"
      ],
      "ballerinaVersion": "2201.12.0",
      "icon": "https://bcentral-packageicons.azureedge.net/images/ballerina_crypto_2.12.1.png",
      "ownerUUID": "b5a9e54d-8ade-47a1-8abc-6bc46e89069d",
      "createdDate": 1778748872000,
      "pullCount": 1725176,
      "visibility": "public",
      "modules": [
        {
          "packageURL": "/ballerina/crypto/2.12.1",
          "apiDocURL": "https://lib.ballerina.io/ballerina/crypto/2.12.1",
          "name": "crypto",
          "summary": "",
          "readme": ""
        }
      ],
      "balToolId": "",
      "graalvmCompatible": "Unknown"
    }
  ],
  "count": 84,
  "offset": 0,
  "limit": 2
}
